{
    "survey_id": "ihrv",
    "language": "EN",
    "short_name": "integrated Heart Rate Variability (iHRV)",
    "full_name": "integrated Heart Rate Variability (iHRV) calculator",
    "description": "The integrated Heart Rate Variability (iHRV) synthesizes results of 29 Heart Rate Variability (HRV) measures (see description for each measure in the table below) into a set of six indexes, one for each orthogonal dimension that underly HRV measures (HRV-D1-6), which are then combined to produce a single integrated index (iHRV). HRV measures assess variation in the time intervals between two successive heartbeats. These measures can be obtained through analysis of an electrocardiogram. Extensive research has found these measures to be indicative of a person’s heart health. However, different measures are often used across research, clinical, and commercial domains, making interpretation of HRV difficult. Wu et al. (submitted) established a method for integrating multiple measures to enable examination of a small set of indexes that reflect the six dimensions of HRV, called Heart Rate Variability of dimensions 1 to 6 (HRV-D1-6). As well, a single index called integrated Heart Rate Variability (iHRV) is derived to allow easy interpretation. Here, we provide the iHRV Calculator for you to try Wu et al. (submitted)’s method! Please input values of HRV measures and we will generate your HRV-D1-6 and iHRV!",
    "survey_type": "psychological",
    "display": false,
    "is_data_collection": false,
    "turn_off_data_collection": true,
    "has_results": true,
    "is_machine_learning": false,
    "instructions": "Please enter your answers below:"
}